{
  "schema": "kiana.legacy-authority-classification.v1",
  "version": "1.0",
  "revision_id": "legacy-authority-2026-07-15-reviewed",
  "revision_kind": "successor",
  "inventory_globs": [
    "docs/reference_audit/*.md",
    "docs/reference-feature-matrix.md",
    "docs/reference-migration-roadmap.md",
    "docs/commercial-release-readiness.md",
    "docs/agent-program/kiana-completion/references.json"
  ],
  "review_revision": "legacy-reviewed-2026-07-17",
  "reviewed_at": "2026-07-17T11:32:00Z",
  "entries": [
    {
      "path": "docs/agent-program/kiana-completion/references.json",
      "content_sha256": "214d2cb85b23a41548ba11147da6574366e9fac9678bf1ca0e789fb4a1fecaf6",
      "classification": "frozen_migration_input",
      "rationale": "docs/agent-program/kiana-completion/references.json contains legacy status, gap, priority, inventory, or readiness material retained as migration input; canonical governance now comes from versioned JSON heads.",
      "replacement_view": "docs/agent-program/kiana-completion/governance/generated/legacy-authority.md",
      "evidence_ids": [
        "ev.legacy.docs-agent-program-kiana-completion-references-json.review"
      ],
      "review_revision": "legacy-review-2026-07-17"
    },
    {
      "path": "docs/commercial-release-readiness.md",
      "content_sha256": "03725f0ff68b413ebf911a8fdee272a58813511ed6b0ddf50afc1905a396a349",
      "classification": "frozen_migration_input",
      "rationale": "docs/commercial-release-readiness.md contains legacy status, gap, priority, inventory, or readiness material retained as migration input; canonical governance now comes from versioned JSON heads.",
      "replacement_view": "docs/agent-program/kiana-completion/governance/generated/legacy-authority.md",
      "evidence_ids": [
        "ev.legacy.docs-commercial-release-readiness-md.review"
      ],
      "review_revision": "legacy-review-2026-07-17"
    },
    {
      "path": "docs/reference-feature-matrix.md",
      "content_sha256": "31e879959450c3cc9f38341bfee705410796b4f41884559e9f07c2ccba396256",
      "classification": "frozen_migration_input",
      "rationale": "docs/reference-feature-matrix.md contains legacy status, gap, priority, inventory, or readiness material retained as migration input; canonical governance now comes from versioned JSON heads.",
      "replacement_view": "docs/agent-program/kiana-completion/governance/generated/legacy-authority.md",
      "evidence_ids": [
        "ev.legacy.docs-reference-feature-matrix-md.review"
      ],
      "review_revision": "legacy-review-2026-07-17"
    },
    {
      "path": "docs/reference-migration-roadmap.md",
      "content_sha256": "112df2f16927b29082ef54a053b5ce1d6cfd504f3a58086684a75fa6095370cd",
      "classification": "frozen_migration_input",
      "rationale": "docs/reference-migration-roadmap.md contains legacy status, gap, priority, inventory, or readiness material retained as migration input; canonical governance now comes from versioned JSON heads.",
      "replacement_view": "docs/agent-program/kiana-completion/governance/generated/legacy-authority.md",
      "evidence_ids": [
        "ev.legacy.docs-reference-migration-roadmap-md.review"
      ],
      "review_revision": "legacy-review-2026-07-17"
    },
    {
      "path": "docs/reference_audit/MetaGPT.md",
      "content_sha256": "bd2c2eff530ebbd92f7886babe79b378e715b9bd970bfeaa74ea8509ad1b4470",
      "classification": "frozen_migration_input",
      "rationale": "docs/reference_audit/MetaGPT.md contains legacy status, gap, priority, inventory, or readiness material retained as migration input; canonical governance now comes from versioned JSON heads.",
      "replacement_view": "docs/agent-program/kiana-completion/governance/generated/legacy-authority.md",
      "evidence_ids": [
        "ev.legacy.docs-reference-audit-metagpt-md.review"
      ],
      "review_revision": "legacy-review-2026-07-17"
    },
    {
      "path": "docs/reference_audit/OpenHands.md",
      "content_sha256": "7227318c6e46b59002e72a353920d5b46f12ec08da149866e3caad7be95697c1",
      "classification": "frozen_migration_input",
      "rationale": "docs/reference_audit/OpenHands.md contains legacy status, gap, priority, inventory, or readiness material retained as migration input; canonical governance now comes from versioned JSON heads.",
      "replacement_view": "docs/agent-program/kiana-completion/governance/generated/legacy-authority.md",
      "evidence_ids": [
        "ev.legacy.docs-reference-audit-openhands-md.review"
      ],
      "review_revision": "legacy-review-2026-07-17"
    },
    {
      "path": "docs/reference_audit/Roo-Code.md",
      "content_sha256": "6b189592c5dcd7642c1c5174980cde6491073e8cf21f248f82f4dc085bffa212",
      "classification": "frozen_migration_input",
      "rationale": "docs/reference_audit/Roo-Code.md contains legacy status, gap, priority, inventory, or readiness material retained as migration input; canonical governance now comes from versioned JSON heads.",
      "replacement_view": "docs/agent-program/kiana-completion/governance/generated/legacy-authority.md",
      "evidence_ids": [
        "ev.legacy.docs-reference-audit-roo-code-md.review"
      ],
      "review_revision": "legacy-review-2026-07-17"
    },
    {
      "path": "docs/reference_audit/agentic_workspace_reference_audit_2026-07-08.md",
      "content_sha256": "46ac83c562697d032e4d8d17adb842fcd58f78bd18ff660da13007fde66d8c10",
      "classification": "frozen_migration_input",
      "rationale": "docs/reference_audit/agentic_workspace_reference_audit_2026-07-08.md contains legacy status, gap, priority, inventory, or readiness material retained as migration input; canonical governance now comes from versioned JSON heads.",
      "replacement_view": "docs/agent-program/kiana-completion/governance/generated/legacy-authority.md",
      "evidence_ids": [
        "ev.legacy.docs-reference-audit-agentic-workspace-reference-audit-2026-07-08-md.review"
      ],
      "review_revision": "legacy-review-2026-07-17"
    },
    {
      "path": "docs/reference_audit/aider.md",
      "content_sha256": "3fbbfc1f39dbf700ad43b58fbc95dfd38f0126d0c602fde0640bdb5a2bc4a00c",
      "classification": "frozen_migration_input",
      "rationale": "docs/reference_audit/aider.md contains legacy status, gap, priority, inventory, or readiness material retained as migration input; canonical governance now comes from versioned JSON heads.",
      "replacement_view": "docs/agent-program/kiana-completion/governance/generated/legacy-authority.md",
      "evidence_ids": [
        "ev.legacy.docs-reference-audit-aider-md.review"
      ],
      "review_revision": "legacy-review-2026-07-17"
    },
    {
      "path": "docs/reference_audit/autogen.md",
      "content_sha256": "aa77c4e7b375833471b235b7cea30deb96c6c6a2356a29e0b6870bbbee357d83",
      "classification": "frozen_migration_input",
      "rationale": "docs/reference_audit/autogen.md contains legacy status, gap, priority, inventory, or readiness material retained as migration input; canonical governance now comes from versioned JSON heads.",
      "replacement_view": "docs/agent-program/kiana-completion/governance/generated/legacy-authority.md",
      "evidence_ids": [
        "ev.legacy.docs-reference-audit-autogen-md.review"
      ],
      "review_revision": "legacy-review-2026-07-17"
    },
    {
      "path": "docs/reference_audit/claude-code-main.md",
      "content_sha256": "29f719957726889dc9a31200381dd5c24fc73b1fcfa91ba735be67ed5cac3ec3",
      "classification": "frozen_migration_input",
      "rationale": "docs/reference_audit/claude-code-main.md contains legacy status, gap, priority, inventory, or readiness material retained as migration input; canonical governance now comes from versioned JSON heads.",
      "replacement_view": "docs/agent-program/kiana-completion/governance/generated/legacy-authority.md",
      "evidence_ids": [
        "ev.legacy.docs-reference-audit-claude-code-main-md.review"
      ],
      "review_revision": "legacy-review-2026-07-17"
    },
    {
      "path": "docs/reference_audit/claude-code-rev-main.md",
      "content_sha256": "78b10d85e12a55e869eb986a994bfc5d9dc73bfa727e0ccff3aeb8c41348b570",
      "classification": "frozen_migration_input",
      "rationale": "docs/reference_audit/claude-code-rev-main.md contains legacy status, gap, priority, inventory, or readiness material retained as migration input; canonical governance now comes from versioned JSON heads.",
      "replacement_view": "docs/agent-program/kiana-completion/governance/generated/legacy-authority.md",
      "evidence_ids": [
        "ev.legacy.docs-reference-audit-claude-code-rev-main-md.review"
      ],
      "review_revision": "legacy-review-2026-07-17"
    },
    {
      "path": "docs/reference_audit/claude-code-rust.md",
      "content_sha256": "420a4c8dd0dc7b60717d5ec45fae0cf83603b915450ac275e80a2caac5823c70",
      "classification": "frozen_migration_input",
      "rationale": "docs/reference_audit/claude-code-rust.md contains legacy status, gap, priority, inventory, or readiness material retained as migration input; canonical governance now comes from versioned JSON heads.",
      "replacement_view": "docs/agent-program/kiana-completion/governance/generated/legacy-authority.md",
      "evidence_ids": [
        "ev.legacy.docs-reference-audit-claude-code-rust-md.review"
      ],
      "review_revision": "legacy-review-2026-07-17"
    },
    {
      "path": "docs/reference_audit/cline.md",
      "content_sha256": "900fc354a48f8e20fbc558ee23a464811b13faf735e41a92a1f6745b04106e01",
      "classification": "frozen_migration_input",
      "rationale": "docs/reference_audit/cline.md contains legacy status, gap, priority, inventory, or readiness material retained as migration input; canonical governance now comes from versioned JSON heads.",
      "replacement_view": "docs/agent-program/kiana-completion/governance/generated/legacy-authority.md",